{
  "schema_version": "v0",
  "operation": "submit_task",
  "task_id": "task-clawd-live-compat-002",
  "requestor": "c_lawd",
  "target_node": "dali",
  "correlation_id": "corr-clawd-live-compat-002",
  "created_at": "2026-03-19T12:44:30Z",
  "payload": {
    "task_type": "execution",
    "prompt": "Execute the faithful C_Lawd local_dispatch compatibility proof after service restart.",
    "local_dispatch": {
      "target_role": "executor",
      "source_role": "planner",
      "chain_id": "chain-clawd-live-compat-002",
      "parent_task_id": "task-clawd-live-parent-002",
      "hop_count": 1,
      "max_hops": 3
    }
  }
}
