{
  "schema_version": "v0",
  "operation": "submit_task",
  "task_id": "task-local-e2e-001",
  "requestor": "c_lawd",
  "target_node": "dali",
  "correlation_id": "corr-local-e2e-001",
  "created_at": "2026-03-18T09:00:00Z",
  "payload": {
    "intent": "summarize",
    "topic": "interbeing local e2e harness",
    "priority": "normal"
  }
}
