{
  "schema_version": "v0",
  "operation": "submit_task",
  "task_id": "task-handoff-file-001",
  "requestor": "c_lawd",
  "target_node": "dali",
  "correlation_id": "corr-handoff-file-001",
  "created_at": "2026-03-18T10:00:00Z",
  "payload": {
    "intent": "summarize",
    "topic": "handoff file path smoke",
    "priority": "normal",
    "handoff_origin": "c_lawd"
  }
}
