{
  "schema_version": "v0",
  "operation": "submit_task",
  "task_id": "task-clawd-live-reviewer-001",
  "requestor": "c_lawd",
  "target_node": "dali",
  "correlation_id": "corr-clawd-live-reviewer-001",
  "created_at": "2026-03-19T12:43:10Z",
  "payload": {
    "intent": "clawd-local-dispatch-live-proof",
    "local_dispatch": {
      "target_role": "reviewer",
      "source_role": "executor",
      "chain_id": "chain-clawd-live-compat-001",
      "parent_task_id": "task-exec-live-compat-001",
      "hop_count": 2,
      "max_hops": 3
    }
  }
}
